{"base_site":{"path":"/srv/sparkinterval-operator/site/azure-cpu-materializer-site.json","sha256":"0000000000000000000000000000000000000000000000000000000000000000","size_bytes":0},"kind":"sparkinterval.azure.cpu.platt-pt21-materializer-site.v1","pt21":{"execution_contract_id":"reference-cpu-flint-3.6-v1","flint_source_root":"/srv/sparkinterval-source/flint-3.6.0","retained_export_root":"/srv/sparkinterval-retained/platt-trudgian-rh-3e12","runtime":{"manifest":{"path":"/srv/sparkinterval-runtime/pt21/runtime-closure.json","sha256":"0000000000000000000000000000000000000000000000000000000000000000","size_bytes":0},"python":{"path":"/srv/sparkinterval-runtime/pt21/python3","sha256":"0000000000000000000000000000000000000000000000000000000000000000","size_bytes":0},"runner":{"path":"/srv/sparkinterval-runtime/pt21/tg_platt_zeta_shard","sha256":"0000000000000000000000000000000000000000000000000000000000000000","size_bytes":0}}},"schema_version":1}
